{
  "kind": "ack",
  "brief_hash": "BR-9e4c1a7b2d05",
  "subject": "P-7F3K9Q.T2",
  "seat": "engineer",
  "objective": "Make TagStore.addTag store every tag trimmed, NFC-normalized and lowercased, at most once per note, so that the two frozen tag tests pass, without touching the tests or anything outside src/store/.",
  "ids": [
    "P-7F3K9Q#ACC-01",
    "P-7F3K9Q#ACC-02",
    "R-notes-4QX7B",
    "ADR-7KQ2B.O1"
  ],
  "non_goals": [
    "Showing or editing tags in the HTTP API or the web UI.",
    "Renaming, merging or deleting tags.",
    "Shared tag vocabularies across users."
  ],
  "write_set": [
    "src/store/**"
  ],
  "steps": [
    "Read tests/notes/tags.test.ts to learn the expected TagStore.addTag behaviour.",
    "Add normalizeTag in src/store/tags.ts: trim, then NFC, then a locale-independent lowercase.",
    "Implement TagStore.addTag on top of NoteStore, skipping a tag the note already has.",
    "Make NoteStore.load treat a missing tags array as no tags.",
    "Run npm test locally, then submit."
  ],
  "assumptions": [
    "Notes are stored one JSON document per note, as ADR-7KQ2B describes.",
    "The store has a single writer, so addTag needs no locking."
  ],
  "questions": []
}
